quote_number,quote_text

1,"In Hollywood, more often than not, they're making more kind of traditional films, stories that are understood by people. And the entire story is understood. And they become worried if even for one small moment something happens that is not understood by everyone."

2,"You get a painting idea, and you go do that. You get a cinema idea, and you go in to do that. The difference is, even though the paintings might take some time to make, with cinema you are booked for a year and a half, minimum."

3,"As a kid, I was always building things. My father had a shop in the house, and we built things - we were kind of a project family. I started out as a painter, and then painting led to cinema, and in cinema, you get to build so many things, or help build them."

4,"I think part of the reason ideas haven't come in is that the world of cinema is changing so drastically, and in a weird way, feature films I think have become cheap. Everything is kind of throwaway. It's experienced and then forgotten."

5,"I love Bob Dylan. Who doesn't? He tapped into some kind of vein and it keeps on keeping on. There's nobody like him. He's unique, and just... way out cool."

6,"I like watercolours. I like acrylic paint... a little bit. I like house paint. I like oil-based paint, and I love oil paint. I love the smell of turpentine and I like that world of oil paint very, very, very much."

7,"I've loved music always, and my music fire was lit by Elvis Presley, really, and all that was happening back then."

8,"I didn't really grow up listening to blues, because I grew up in the Northwest. It wasn't really the center for blues."

9,"I think that commercials can really ruin a song. You know that the person sold the song for a good deal of money, and that was the tradeoff. But, music and picture can marry in a beautiful way, and the reverse also."

10,"Digital video is so beautiful. It's lightweight, modern, and it's only getting better. It's put film into the La Brea Tar Pits."

11,"Sometimes I get ideas for lyrics in anyplace, but I work a lot in the studio. So I collect little bits of lyrics. I go through the box of lyrics I have and see if something fits."

12,"People think in Hollywood there's a family, where everybody gets together talks about stuff and we all know each other, and it's just not that way at all to me."

13,"An artist makes a painting, and nobody bugs him or her about it. It's just you and your painting. To me, that's the way it should be with film as well."

14,"You're right on the money with that. We're all like detectives in life. There's something at the end of the trail that we're all looking for."

15,"A filmmaker doesn't have to suffer to show suffering. You just have to understand it. You don't have to die to shoot a death scene."

16,"The business side of film has goofed up so many things, but even that's changing. It happened to the music industry and now it's happening to the film studios. It's crazy what's going on. But artists should have control of their work; especially if, as I always say, you never turn down a good idea and never take a bad idea."

17,"There are only 24 hours in a day, and my top priority is working on my films, but I love short film experiments."

18,"I always loved smokestack industry, and I love towns or cities that have grown up around factories."

19,"Music as background to me becomes like a mosquito, an insect. In the studio we have big speakers, and to me that's the way music should be listened to. When I listen to music, I want to just listen to music."

20,"Transcendental meditation is an ancient mental technique that allows any human being to dive within, transcend and experience the source of everything. It's such a blessing for the human being because that eternal field is a field of unbounded intelligence, creativity, happiness, love, energy and peace."

21,"I have no problem getting financing. I have a problem catching ideas that I fall in love with for the next feature."

22,"I like things to be orderly."

23,"A lot of music doesn't do one thing or another. It just doesn't do anything. Then there are those pieces of music that thrill your soul. It's such a wide range, and it's really interesting that we all love different things."

24,"Building a set is like building a place, but it's a temporary place, because sets usually get torn down. Kind of unfortunate."

25,"Humor is very interesting to me. My films are not comedies, but there's comedy in them from time to time, absurdities, just like in real life."

26,"More and more people are seeing the films on computers - lousy sound, lousy picture - and they think they've seen the film, but they really haven't."

27,"I thought when I started meditation that I was going to get real calm and peaceful and it's going to be over. It's not that way; it's so energetic. That's where all the energy and creativity is."

28,"What I really like is to be at home, working."

29,"The greatest thing my father left me was a love for cutting wood - my love for sawing, especially pine wood."

30,"You don't need a special place to meditate. You can transcend anywhere in the world. The unified field is here, and there, and everywhere."

31,"A lot of painters listen to music, I think, while they paint. But I hate to do that. It's a horror. I can't really listen to the music. I'm not really concentrating on it, and I'm not really concentrating on the painting."

32,"This whole world is wild at heart and weird on top."

33,"Every viewer is going to get a different thing. That's the thing about painting, photography, cinema."

34,"Negativity is the enemy of creativity."

35,"I love paint. I like watercolours. I like acrylic paint... a little bit. I like house paint. I like oil-based paint, and I love oil paint. I love the smell of turpentine and I like that world of oil paint very, very, very much."

36,"The concept of absurdity is something I'm attracted to."

37,"I discovered that if one looks a little closer at this beautiful world, there are always red ants underneath."

38,"Intuition is the key to everything, in painting, filmmaking, business - everything. I think you could have an intellectual ability, but if you can sharpen your intuition, which they say is emotion and intellect joining together, then a knowingness occurs."

39,"I like cappuccino, actually. But even a bad cup of coffee is better than no coffee at all."

40,"Happy accidents are real gifts, and they can open the door to a future that didn't even exist. It's kind of nice sometimes to set up something to encourage or allow happy accidents to happen."

41,"Life should be blissful, and blissful doesn't mean just a small happiness. It's huge. It is profound."

42,"I always say Philadelphia, Pennsylvania is my biggest influence. But for painters, I like many, many painters, but I love Francis Bacon the most, and Edward Hopper."

43,"My cow is not pretty, but it is pretty to me."

44,"I think that ideas exist outside of ourselves. I think somewhere, we're all connected off in some very abstract land. But somewhere between there and here ideas exist."

45,"Meditation is to dive all the way within, beyond thought, to the source of thought and pure consciousness. It enlarges the container, every time you transcend. When you come out, you come out refreshed, filled with energy and enthusiasm for life."

46,"I don't think that people accept the fact that life doesn't make sense. I think it makes people terribly uncomfortable. It seems like religion and myth were invented against that, trying to make sense out of it."

47,"I don't remember my dreams too much. I hardly have ever gotten ideas from nighttime dreams. But I love daydreaming and dream logic and the way dreams go."

48,"I'm not a musician, but I play music. So it's a strange thing."

49,"A lot of artists think they want anger. But a real, strong, bitter anger occupies the mind, leaving no room for creativity."

50,"Life is very, very complicated, and so films should be allowed to be, too."

51,"A poet could write volumes about diners, because they're so beautiful. They're brightly lit, with chrome and booths and Naugahyde and great waitresses. Now, it might not be so great in the health department, but I think diner food is really worth experiencing periodically."

52,"Sugar does make people happy, but then you fall off the edge after a few minutes, so I've really pretty much cut it out of my diet. Except for cupcakes. I like those."

53,"Absurdity is what I like most in life, and there's humor in struggling in ignorance. If you saw a man repeatedly running into a wall until he was a bloody pulp, after a while it would make you laugh because it becomes absurd."

54,"To me, a story can be both concrete and abstract, or a concrete story can hold abstractions. And abstractions are things that really can't be said so well with words."

55,"It makes me uncomfortable to talk about meanings and things. It's better not to know so much about what things mean. Because the meaning, it's a very personal thing, and the meaning for me is different than the meaning for somebody else."

56,"If you stay true to your ideas, film-making becomes an inside-out, honest kind of process."

57,"Somehow, the French got this idea of the starving artist. Very romantic, except it's not so romantic for the starving artist."

58,"Film can't just be a long line of bliss. There's something we all like about the human struggle."

59,"I've said many, many, many unkind things about Philadelphia, and I meant every one."

60,"Transcendental meditation is like a car, a vehicle that allows you to go within. It's a mental technique."

61,"I believe in creative control. No matter what anyone makes, they should have control over it."

62,"The mantra that you're given in Transcendental Meditation you keep to yourself. The reason being, true happiness is not out there, true happiness lies within."

63,"I love super crispy, almost burned, snapping-crispy bacon."

64,"Stories hold conflict and contrast, highs and lows, life and death, and the human struggle and all kinds of things."

65,"If we didn't want to upset anyone, we would make films about sewing, but even that could be dangerous. But I think finally, in a film, it is how the balance is and the feelings are. But I think there has to be those contrasts and strong things within a film for the total experience."

66,"I was raised Presbyterian, but I'm not really going to church. I think the experience in meditation is pretty much where it's at for me."

67,"The cinema is really built for the big screen and big sound, so that a person can go into another world and have an experience."

68,"Cinema is a medium that can translate ideas."

69,"Music deals with time and timing. It's so magical, but when you get into it, every little sound and every little space between the sounds, it's critical, so critical. And if it's not there, it not only feels wrong, but it ruins things."

70,"Everyone is on the internet but they're not all talking with each other. There are groups upon groups out there, but they don't talk to one another. So while the internet brings everyone into a shared space, it does not necessarily bring them together."

71,"Some things we forget. But many things we remember on the mental screen, which is the biggest screen of all."

72,"See, a painting is much cheaper than making a film. And photography is, you know, way cheap. So if I get an idea for a film, there are many ways to get it together and go realise that film. There's really nothing to be afraid of."

73,"I don't paint the town red. But when I do go out, people always want to touch my hair. It happens every time."

74,"The ideas dictate everything, you have to be true to that or you're dead."

75,"I don't like Thomas Edison. I'm a fan of Nicolai Tesla."

76,"I supported myself by delivering the 'Wall Street Journal' and doing odd jobs. I love plumbing and carpentry."

77,"I didn't watch much TV as a kid and I don' t watch it now. I don' t find anything beautiful or unique to the medium, and the only thing you can do on TV that you can't do in film is make a continuing story - which is so cool!"

78,"Sex is a doorway to something so powerful and mystical, but movies usually depict it in a completely flat way."

79,"Sometimes I get an idea for cinema. And when you get an idea that you fall in love with, this is a glorious day."

80,"I like L.A. because of the light. The light makes me feel so good. It's really beautiful. And there's something about L.A. being so spread out that gives you a feeling of freedom. Light and freedom."

81,"To make the script, you need ideas, and for me a lot of times, a final script is made up of many fragments of ideas that came at different times."

82,"I've always loved the electric guitar: to hold it and work it and hear what it does is unreal."

83,"I love Christmas tree bulbs, and I started putting them in my paintings. You've got to plug this painting in, and it's got a rig in the back, so that each one can be replaced if it burns out."

84,"Somewhere in talking and rehearsing, there is a magical moment where actors catch a current, they're on the right road. If they really catch it, then whatever they do from then on is correct and it all comes out of them from that point on."

85,"Most of Hollywood is about making money - and I love money, but I don't make the films thinking about money."

86,"Television provides the opportunity for an ongoing story - the opportunity to meld the cast and the characters and a world, and to spend more time there."

87,"I love music, of course, and many, many, many genres. There are hardly any songs I would say that I hate. There's a couple, and I don't even know exactly why I don't like them."

88,"I love the quality, feel and history of film. I love the pictures of the giant cameras and the way it was."

89,"Francis Bacon is one of my giant inspirations. I just love him to pieces."

90,"A film - especially when it's a personal film - is going to hit somebody or it's not. There's nothing you can do about it."

91,"I'm not a real film buff. Unfortunately, I don't have time. I just don't go. And I become very nervous when I go to a film because I worry so much about the director and it is hard for me to digest my popcorn."

92,"I don’t know why people expect art to make sense. They accept the fact that life doesn’t make sense."

93,"The more unknowable the mystery, the more beautiful it is."

94,"I like things that go into hidden, mysterious places, places I want to explore that are very disturbing. In that disturbing thing, there is sometimes tremendous poetry and truth."

95,"The world is as you are."

96,"We only dream of images we already have inside of us."

97,"Ideas are like fish. If you want to catch little fish, you can stay in the shallow water. But if you want to catch the big fish, you’ve got to go deeper. Down deep, the fish are more powerful and more pure. They’re huge and abstract. And they’re very beautiful."

98,"Negativity is the enemy of creativity."

99,"What do you fear, most of all? The possibility that love may not be enough."

100,"New mysteries. New day. Fresh doughnuts."

101,"I’m not comfortable with words. I love images, and I love sounds, and I love feelings. I like the idea of intuition. I think a lot of things in life are understood that way. But you internalize these things; they don’t really pop out. Certain things are built inside – little areas of understanding. I feel that I live in darkness and confusion, and I’m trying, like we all are, to make some sort of sense of it."

102,"In today’s world of fear and uncertainty, every child should have one class period a day to dive within himself and experience the field of silence – bliss – the enormous reservoir of energy and intelligence that is deep within all of us. This is the way to save the coming generation."

103,"Mankind was not meant to suffer — bliss is our nature. The individual is cosmic. Let’s rock."

104,"We think we understand the rules when we become adults but what we really experience is a narrowing of the imagination."

105,"I like to make films because I like to go into another world. I like to get lost in another world. And film to me is a magical medium that makes you dream… allows you to dream in the dark. It’s just a fantastic thing, to get lost inside the world of film."

106,"This whole world is wild at heart and weird on top."

107,"The day you catch an idea you fall in love with, even a small one, is a beautiful day."

108,"There is this unbounded, infinite, eternal, level, ocean, within every human being. Inner happiness comes with consciousness, bliss, intelligence comes with it. Creativity, love."

109,"Human beings have a potential and it has names like enlightenment or fulfilment, or liberation."

110,"True happiness is not out there, true happiness lies within."

111,"They say beauty is only skin deep but it’s this stuff coming from the inside, absolute vibrant consciousness, absolute bliss"

112,"The artist does not have to suffer to show suffering."

113,"It’s so freeing, it’s beautiful in a way, to have a great failure, there’s nowhere to go but up."

114,"Float with me in the world of ether."

115,"We all have at least two sides. The world we live in is a world of opposites. And the trick is to reconcile those opposing things. I’ve always liked both sides. In order to appreciate one you have to know the other. The more darkness you can gather up, the more light you can see too."

116,"Absurdity is what I like most in life."

117,"There is an ocean of creativity within every human being."

118,"Tenderness can be just as abstract as insanity."

119,"I like darkness and confusion and absurdity, but I like to know that there could be a little door that you could go out into a safe life area of happiness."

120,"Individual peace is the unit of world peace."

121,"Inside, we are ageless and when we talk to ourselves, it’s the same age of the person we were talking to when we were little. It’s the body that is changing around that ageless center."

122,"Directors who have inspired me include Billy Wilder, Federico Fellini, lngmar Bergman, John Ford, Orson Welles, Werner Herzog, Stanley Kubrick, Alfred Hitchcock, Francis Ford Coppola and Ernst Lubitsch. In art school, I studied painters like Edward Hopper, who used urban motifs, Franz Kafka is my favorite novelist. My approach to film stems from my art background, as I go beyond the story to the sub-conscious mood created by sound and images."

123,"Many things happen that we don’t know the significance of until a little bit later."

124,"I’m not a political person. I don’t understand politics, I don’t understand the concept of two sides and I think that probably there’s good on both sides, bad on both sides, and there’s a middle ground, but it never seems to come to the middle ground and it’s very frustrating watching it and seemingly we’re not moving forward."

125,"I started Transcendental Meditation in 1973 and have not missed a single meditation ever since. Twice a day, every day. It has given me effortless access to unlimited reserves of energy, creativity, and happiness deep within."

126,"Film noir has a mood that everyone can feel. It’s people in trouble, at night, with a little bit of wind and the right kind of music. It’s a beautiful thing."

127,"Intuition is the key to everything, in painting, filmmaking, business – everything. I think you could have an intellectual ability, but if you can sharpen your intuition, which they say is emotion and intellect joining together, then a knowingness occurs."

128,"There is an ocean of pure vibrant consciousness inside each one of us."

129,"The only thing that disturbs me is that many psychopaths say they had a very happy childhood."

130,"I love child things because there’s so much mystery when you’re a child. When you’re a child, something as simple as a tree doesn’t make sense. You see it in the distance and it looks small, but as you go closer, it seems to grow – you haven’t got a handle on the rules when you’re a child. We think we understand the rules when we become adults but what we really experienced is a narrowing of the imagination."

131,"Intuition is knowingness, and this field of unbounded knowing, of knowingness, is within every human being. You start tapping into that and it becomes an ocean of solutions."

132,"I like making films because I like to go into another world. I like to get lost into another world."

133,"I learned that just beneath the surface there’s another world, and still different worlds as you dig deeper. I knew it as a kid, but I couldn’t find the proof. It was just a kind of feeling. There is goodness in blue skies and flowers, but another force – a wild pain and decay – also accompanies everything."

134,"I just like going into strange worlds."

135,"You need contrast and conflict in order to tell a story. Stories need to have dark and light, turmoil, all those things. But that does not mean the filmmaker has to suffer in order to show the suffering. Stories should have the suffering, not the people."

136,"Life is very, very complicated, and so films should be allowed to be, too."

137,"The cinema is really built for the big screen and big sound, so that a person can go into another world and have an experience."

138,"Black has depth.. you can go into it.. And you start seeing what you’re afraid of. You start seeing what you love, and it becomes like a dream."

139,"Life is filled with abstractions, and the only way to make heads or tails of it is going through intuition."

140,"Stories have tangents; they open up and become different things. You can still have a structure, but you should leave room to dream. If you stay true to your ideas, filmmaking becomes an inside-out, honest kind of process. And if it’s an honest thing for you, there’s a chance that people will feel that, even if it’s abstract."

141,"Meditation is not a selfish thing. Even though you’re diving in and experiencing the Self, you’re not closing yourself off from the world. You’re strengthening yourself, so that you can be more effective when you go back into the world."

142,"I love seeing people come out of darkness."

143,"If you have a golf-ball-sized consciousness, when you read a book, you’ll have a golf-ball-sized understanding; when you look out a window, a golf-ball-sized awareness, when you wake up in the morning, a golf-ball-sized wakefulness; and as you go about your day, a golf-ball-sized inner happiness. But if you can expand that consciousness, make it grow, then when you read about that book, you’ll have more understanding; when you look out, more awareness; when you wake up, more wakefulness; as you go about your day, more inner happiness."

144,"All my movies are about strange worlds that you can’t go into unless you build them and film them. That’s what’s so important about film to me. I just like going into strange worlds."

145,"Sex is a doorway to something so powerful and mystical, but movies usually depict it in a completely flat way."

146,"I discovered that if one looks a little closer at this beautiful world, there are always red ants underneath."

147,"In the world there’s a thing called collective consciousness. All of us billions of human beings together create that collective consciousness. With all the problems in our world, you can see that the collective consciousness is not so high."

148,"Stories always have held conflicts and contrasts, highs and lows, life and death situations. And there can be much suffering in stories, but now we say the artist doesn’t have to suffer to show suffering. You just have to understand the human condition, understand the suffering."

149,"Through the darkness of future past, the magician longs to see, one chance out between two worlds, fire walk with me!"

150,"Intuition is the key to everything, in painting, filmmaking, business – everything. I think you could have an intellectual ability, but if you can sharpen your intuition, which they say is emotion and intellect joining together, then a knowingness occurs. Feeling correct is a feeling I think everyone knows."

151,"There’s always fear of the unknown where there’s mystery."

152,"I hate slick and pretty things. I prefer mistakes and accidents. Which is why I like things like cuts and bruises – they’re like little flowers. I’ve always said that if you have a name for something, like ‘cut’ or ‘bruise,’ people will automatically be disturbed by it. But when you see the same thing in nature, and you don’t know what it is, it can be very beautiful."

153,"Every single thing in the world that was made by anyone started with an idea. So to catch one that is powerful enough to fall in love with, it is one of the most beautiful experiences. It’s like being jolted with electricity and knowledge at the same time."

154,"Lately I feel films are more and more like music. Music deals with abstractions and, like film, it involves time. It has many different movements, it has much contrast. And through music you learn that, in order to get a particular beautiful feeling, you have to have started far back, arranging certain things in a certain way. You can’t just cut to it."

155,"I like to remember things my own way. How I remembered them, not necessarily the way they happened."

156,"You don’t dive for specific solutions; you dive to enliven that ocean of consciousness. Then your intuition grows and you have a way of solving those problems-knowing when it’s not quite right and knowing a way to make it feel correct for you. That capacity grows and things go much more smoothly."

